{
  "schema_version": "a-rolling-energy-v3",
  "mode": "demo",
  "generated_at": "2026-07-23T04:00:00Z",
  "data_as_of": "2026-07-21T03:00:00Z",
  "freshness": "stale",
  "stale_after_seconds": 900,
  "notice": "上海电力双向能量传导演示快照；页面展示信号状态与数据时点，不生成仓位或交易指令。",
  "delivery": {
    "state": "lkg",
    "reason": "等待34周期实时上游信号源"
  },
  "instrument": {
    "instrument_name": "上海电力",
    "exchange": "SSE",
    "symbol": "600021"
  },
  "transmission": {
    "state": "stopped",
    "basis": "single_run",
    "current_cycle_code": "D4",
    "stopped_at_code": "D5",
    "started_at": "2026-07-17T01:30:00Z",
    "lit_count": 19,
    "continuous_confirmed": true
  },
  "cycles": [
    {
      "cycle_code": "PRE",
      "segment": "预备",
      "timeframe_minutes": 105,
      "timeframe_label": "1小时45分钟",
      "buy_state": "BUY",
      "buy_triggered_at": "2026-07-17T01:30:00Z",
      "source": "DEMO_FIXTURE"
    },
    {
      "cycle_code": "A1",
      "segment": "A",
      "timeframe_minutes": 120,
      "timeframe_label": "2小时",
      "buy_state": "BUY",
      "buy_triggered_at": "2026-07-17T01:30:00Z",
      "source": "DEMO_FIXTURE"
    },
    {
      "cycle_code": "A2",
      "segment": "A",
      "timeframe_minutes": 135,
      "timeframe_label": "2小时15分钟",
      "buy_state": "BUY",
      "buy_triggered_at": "2026-07-17T01:30:00Z",
      "source": "DEMO_FIXTURE"
    },
    {
      "cycle_code": "A3",
      "segment": "A",
      "timeframe_minutes": 150,
      "timeframe_label": "2小时30分钟",
      "buy_state": "BUY",
      "buy_triggered_at": "2026-07-17T01:30:00Z",
      "source": "DEMO_FIXTURE"
    },
    {
      "cycle_code": "A4",
      "segment": "A",
      "timeframe_minutes": 165,
      "timeframe_label": "2小时45分钟",
      "buy_state": "BUY",
      "buy_triggered_at": "2026-07-17T01:30:00Z",
      "source": "DEMO_FIXTURE"
    },
    {
      "cycle_code": "B1",
      "segment": "B",
      "timeframe_minutes": 180,
      "timeframe_label": "3小时",
      "buy_state": "BUY",
      "buy_triggered_at": "2026-07-20T01:30:00Z",
      "source": "DEMO_FIXTURE"
    },
    {
      "cycle_code": "B2",
      "segment": "B",
      "timeframe_minutes": 195,
      "timeframe_label": "3小时15分钟",
      "buy_state": "BUY",
      "buy_triggered_at": "2026-07-20T01:30:00Z",
      "source": "DEMO_FIXTURE"
    },
    {
      "cycle_code": "B3",
      "segment": "B",
      "timeframe_minutes": 210,
      "timeframe_label": "3小时30分钟",
      "buy_state": "BUY",
      "buy_triggered_at": "2026-07-20T01:30:00Z",
      "source": "DEMO_FIXTURE"
    },
    {
      "cycle_code": "B4",
      "segment": "B",
      "timeframe_minutes": 225,
      "timeframe_label": "3小时45分钟",
      "buy_state": "BUY",
      "buy_triggered_at": "2026-07-20T01:30:00Z",
      "source": "DEMO_FIXTURE"
    },
    {
      "cycle_code": "C1",
      "segment": "C",
      "timeframe_minutes": 240,
      "timeframe_label": "4小时",
      "buy_state": "BUY",
      "buy_triggered_at": "2026-07-20T01:30:00Z",
      "source": "DEMO_FIXTURE"
    },
    {
      "cycle_code": "C2",
      "segment": "C",
      "timeframe_minutes": 250,
      "timeframe_label": "4小时10分钟",
      "buy_state": "BUY",
      "buy_triggered_at": "2026-07-20T01:30:00Z",
      "source": "DEMO_FIXTURE"
    },
    {
      "cycle_code": "C3",
      "segment": "C",
      "timeframe_minutes": 260,
      "timeframe_label": "4小时20分钟",
      "buy_state": "BUY",
      "buy_triggered_at": "2026-07-20T01:30:00Z",
      "source": "DEMO_FIXTURE"
    },
    {
      "cycle_code": "C4",
      "segment": "C",
      "timeframe_minutes": 270,
      "timeframe_label": "4小时30分钟",
      "buy_state": "BUY",
      "buy_triggered_at": "2026-07-20T01:30:00Z",
      "source": "DEMO_FIXTURE"
    },
    {
      "cycle_code": "C5",
      "segment": "C",
      "timeframe_minutes": 280,
      "timeframe_label": "4小时40分钟",
      "buy_state": "BUY",
      "buy_triggered_at": "2026-07-20T01:30:00Z",
      "source": "DEMO_FIXTURE"
    },
    {
      "cycle_code": "C6",
      "segment": "C",
      "timeframe_minutes": 290,
      "timeframe_label": "4小时50分钟",
      "buy_state": "BUY",
      "buy_triggered_at": "2026-07-20T01:30:00Z",
      "source": "DEMO_FIXTURE"
    },
    {
      "cycle_code": "D1",
      "segment": "D",
      "timeframe_minutes": 300,
      "timeframe_label": "5小时",
      "buy_state": "BUY",
      "buy_triggered_at": "2026-07-20T01:30:00Z",
      "source": "DEMO_FIXTURE"
    },
    {
      "cycle_code": "D2",
      "segment": "D",
      "timeframe_minutes": 310,
      "timeframe_label": "5小时10分钟",
      "buy_state": "BUY",
      "buy_triggered_at": "2026-07-20T01:30:00Z",
      "source": "DEMO_FIXTURE"
    },
    {
      "cycle_code": "D3",
      "segment": "D",
      "timeframe_minutes": 320,
      "timeframe_label": "5小时20分钟",
      "buy_state": "BUY",
      "buy_triggered_at": "2026-07-20T01:30:00Z",
      "source": "DEMO_FIXTURE"
    },
    {
      "cycle_code": "D4",
      "segment": "D",
      "timeframe_minutes": 330,
      "timeframe_label": "5小时30分钟",
      "buy_state": "BUY",
      "buy_triggered_at": "2026-07-20T01:30:00Z",
      "source": "DEMO_FIXTURE"
    },
    {
      "cycle_code": "D5",
      "segment": "D",
      "timeframe_minutes": 340,
      "timeframe_label": "5小时40分钟",
      "buy_state": "STOPPED",
      "buy_triggered_at": null,
      "source": "DEMO_FIXTURE"
    },
    {
      "cycle_code": "D6",
      "segment": "D",
      "timeframe_minutes": 350,
      "timeframe_label": "5小时50分钟",
      "buy_state": "INACTIVE",
      "buy_triggered_at": null,
      "source": "DEMO_FIXTURE"
    },
    {
      "cycle_code": "E1",
      "segment": "E",
      "timeframe_minutes": 360,
      "timeframe_label": "6小时",
      "buy_state": "INACTIVE",
      "buy_triggered_at": null,
      "source": "DEMO_FIXTURE"
    },
    {
      "cycle_code": "E2",
      "segment": "E",
      "timeframe_minutes": 370,
      "timeframe_label": "6小时10分钟",
      "buy_state": "INACTIVE",
      "buy_triggered_at": null,
      "source": "DEMO_FIXTURE"
    },
    {
      "cycle_code": "E3",
      "segment": "E",
      "timeframe_minutes": 380,
      "timeframe_label": "6小时20分钟",
      "buy_state": "INACTIVE",
      "buy_triggered_at": null,
      "source": "DEMO_FIXTURE"
    },
    {
      "cycle_code": "E4",
      "segment": "E",
      "timeframe_minutes": 390,
      "timeframe_label": "6小时30分钟",
      "buy_state": "INACTIVE",
      "buy_triggered_at": null,
      "source": "DEMO_FIXTURE"
    },
    {
      "cycle_code": "E5",
      "segment": "E",
      "timeframe_minutes": 400,
      "timeframe_label": "6小时40分钟",
      "buy_state": "INACTIVE",
      "buy_triggered_at": null,
      "source": "DEMO_FIXTURE"
    },
    {
      "cycle_code": "E6",
      "segment": "E",
      "timeframe_minutes": 410,
      "timeframe_label": "6小时50分钟",
      "buy_state": "INACTIVE",
      "buy_triggered_at": null,
      "source": "DEMO_FIXTURE"
    },
    {
      "cycle_code": "F1",
      "segment": "F",
      "timeframe_minutes": 420,
      "timeframe_label": "7小时",
      "buy_state": "INACTIVE",
      "buy_triggered_at": null,
      "source": "DEMO_FIXTURE"
    },
    {
      "cycle_code": "F2",
      "segment": "F",
      "timeframe_minutes": 430,
      "timeframe_label": "7小时10分钟",
      "buy_state": "INACTIVE",
      "buy_triggered_at": null,
      "source": "DEMO_FIXTURE"
    },
    {
      "cycle_code": "F3",
      "segment": "F",
      "timeframe_minutes": 440,
      "timeframe_label": "7小时20分钟",
      "buy_state": "INACTIVE",
      "buy_triggered_at": null,
      "source": "DEMO_FIXTURE"
    },
    {
      "cycle_code": "F4",
      "segment": "F",
      "timeframe_minutes": 450,
      "timeframe_label": "7小时30分钟",
      "buy_state": "INACTIVE",
      "buy_triggered_at": null,
      "source": "DEMO_FIXTURE"
    },
    {
      "cycle_code": "F5",
      "segment": "F",
      "timeframe_minutes": 460,
      "timeframe_label": "7小时40分钟",
      "buy_state": "INACTIVE",
      "buy_triggered_at": null,
      "source": "DEMO_FIXTURE"
    },
    {
      "cycle_code": "F6",
      "segment": "F",
      "timeframe_minutes": 470,
      "timeframe_label": "7小时50分钟",
      "buy_state": "INACTIVE",
      "buy_triggered_at": null,
      "source": "DEMO_FIXTURE"
    },
    {
      "cycle_code": "G",
      "segment": "G",
      "timeframe_minutes": 480,
      "timeframe_label": "8小时",
      "buy_state": "INACTIVE",
      "buy_triggered_at": null,
      "source": "DEMO_FIXTURE"
    }
  ],
  "sell_chain": {
    "window_type": "8min",
    "window_description": "买方传导到达 D30（超过4小时），采用 8分钟 卖出预警窗口",
    "warning_star": {
      "code": "★",
      "timeframe_minutes": 8,
      "timeframe_label": "8分钟预警",
      "sell_state": "SELL",
      "triggered_at": "2026-07-21T01:38:00Z"
    },
    "nodes": [
      {
        "code": "Ⅰ",
        "timeframe_minutes": 10,
        "timeframe_label": "10分钟",
        "sell_state": "SELL",
        "triggered_at": "2026-07-21T03:00:00Z"
      },
      {
        "code": "Ⅱ",
        "timeframe_minutes": 15,
        "timeframe_label": "15分钟",
        "sell_state": "SELL",
        "triggered_at": "2026-07-21T01:30:00Z"
      },
      {
        "code": "Ⅲ",
        "timeframe_minutes": 30,
        "timeframe_label": "30分钟",
        "sell_state": "OBSERVING",
        "triggered_at": null
      },
      {
        "code": "Ⅳ",
        "timeframe_minutes": 45,
        "timeframe_label": "45分钟",
        "sell_state": "INACTIVE",
        "triggered_at": null
      },
      {
        "code": "Ⅴ",
        "timeframe_minutes": 60,
        "timeframe_label": "1小时",
        "sell_state": "INACTIVE",
        "triggered_at": null
      }
    ]
  },
  "sell_alerts": [
    {
      "alert_id": "sell-alert-shanghai-electric",
      "cycle_code": "Ⅰ",
      "timeframe_minutes": 10,
      "triggered_at": "2026-07-21T03:00:00Z",
      "transmission_position": "D4",
      "remaining_session_minutes": 120,
      "analysis_state": "ready",